number,crn,name,days,time,room,instructor,avail_max,desc,gen_ed
COMP 484-01,10425,Introduction to Artificial Intelligence,M W F,03:30 pm-04:30 pm,OLRI 258,Susan Fox,2 / 35,"An introduction to the basic principles and techniques of artificial intelligence. Topics will include specific AI techniques, a range of application areas, and connections between AI and other areas of study (i.e., philosophy, psychology). Techniques may include heuristic search, automated reasoning, machine learning, deliberative planning and behavior-based agent control. Application areas include robotics, games, knowledge representation, and natural language processing. This course involves programming in Python; students should have a basic familiarity with Python or be prepared to learn Python during the course. This course counts as the capstone. Prerequisite(s): COMP 221, or permission of instructor.",Writing WP
COMP 487-01,10714,Computer Security and Privacy,M W F,10:50 am-11:50 am,OLRI 254,Abby Marsh,4 / 20,"An introduction to computer security and privacy. Topics will include privacy, threat modeling, software security, web tracking, web security, usable privacy and security, authentication, anonymity, network security, social engineering, the relationship of the law to security and privacy, and ethics. This course will include hands-on experience with security exploits in a Linux environment and student-led discussions of research papers. Students will complete a capstone project in a security- or privacy-related topic of their choice. Prerequisite(s): COMP 240",
ECON 113-01,10180,Financial Accounting,T R,08:00 am-09:30 am,CARN 305,Bridgit Jordan,2 / 25,"Accounting is the language of business. One of the objectives of this course is to learn that ""language."" The emphasis will be on understanding financial statements both for profit and non-profit organizations. International accounting, ethics and investment decisions are also covered. This course is designed for students who desire an understanding of the elements of accounting as a component of a liberal arts education as well as for those who would like to study further in accounting or business. This course counts as a Group B elective.",
ECON 113-02,10181,Financial Accounting,T R,09:40 am-11:10 am,CARN 305,Bridgit Jordan,2 / 25,"Accounting is the language of business. One of the objectives of this course is to learn that ""language."" The emphasis will be on understanding financial statements both for profit and non-profit organizations. International accounting, ethics and investment decisions are also covered. This course is designed for students who desire an understanding of the elements of accounting as a component of a liberal arts education as well as for those who would like to study further in accounting or business. This course counts as a Group B elective.",
ECON 119-01,10183,Principles of Economics,M W F,10:50 am-11:50 am,LIBR 250,Felix Friedt,0 / 25,"Economics is the study of how people make decisions and how these decisions apply to real-world problems. Economics can help us understand income inequality within and across countries, the quality of the environment, unemployment, poverty, crime, health care, financial crises, technological change, inflation and many more issues. This course introduces the basic tools that economists use to explore these topics and will cover fundamental economic concepts like scarcity, supply and demand, costs and benefits, trade-offs, and incentives. This course is a one semester overview of both microeconomics (the study of choices firms and individual consumers make) and macroeconomics (the study of the economy as a whole). This course counts as a Group E economics course and is the prerequisite for 200-level E courses in the Economics Department.",Quantitative Thinking Q3
ECON 119-02,10184,Principles of Economics,T R,09:40 am-11:10 am,THEATR 206,Mario Solis-Garcia,-2 / 25,"Economics is the study of how people make decisions and how these decisions apply to real-world problems. Economics can help us understand income inequality within and across countries, the quality of the environment, unemployment, poverty, crime, health care, financial crises, technological change, inflation and many more issues. This course introduces the basic tools that economists use to explore these topics and will cover fundamental economic concepts like scarcity, supply and demand, costs and benefits, trade-offs, and incentives. This course is a one semester overview of both microeconomics (the study of choices firms and individual consumers make) and macroeconomics (the study of the economy as a whole). This course counts as a Group E economics course and is the prerequisite for 200-level E courses in the Economics Department.","Writing WP
                    Quantitative Thinking Q3"
ECON 119-03,10185,Principles of Economics,T R,01:20 pm-02:50 pm,CARN 206,Sarah West,0 / 25,"Economics is the study of how people make decisions and how these decisions apply to real-world problems. Economics can help us understand income inequality within and across countries, the quality of the environment, unemployment, poverty, crime, health care, financial crises, technological change, inflation and many more issues. This course introduces the basic tools that economists use to explore these topics and will cover fundamental economic concepts like scarcity, supply and demand, costs and benefits, trade-offs, and incentives. This course is a one semester overview of both microeconomics (the study of choices firms and individual consumers make) and macroeconomics (the study of the economy as a whole). This course counts as a Group E economics course and is the prerequisite for 200-level E courses in the Economics Department.",Quantitative Thinking Q3
ECON 119-04,10186,Principles of Economics,M W F,01:10 pm-02:10 pm,CARN 304,Helen Scharber,0 / 25,"Economics is the study of how people make decisions and how these decisions apply to real-world problems. Economics can help us understand income inequality within and across countries, the quality of the environment, unemployment, poverty, crime, health care, financial crises, technological change, inflation and many more issues. This course introduces the basic tools that economists use to explore these topics and will cover fundamental economic concepts like scarcity, supply and demand, costs and benefits, trade-offs, and incentives. This course is a one semester overview of both microeconomics (the study of choices firms and individual consumers make) and macroeconomics (the study of the economy as a whole). This course counts as a Group E economics course and is the prerequisite for 200-level E courses in the Economics Department.",Quantitative Thinking Q3
ECON 119-05,10187,Principles of Economics,M W F,02:20 pm-03:20 pm,CARN 304,Helen Scharber,6 / 25,"Economics is the study of how people make decisions and how these decisions apply to real-world problems. Economics can help us understand income inequality within and across countries, the quality of the environment, unemployment, poverty, crime, health care, financial crises, technological change, inflation and many more issues. This course introduces the basic tools that economists use to explore these topics and will cover fundamental economic concepts like scarcity, supply and demand, costs and benefits, trade-offs, and incentives. This course is a one semester overview of both microeconomics (the study of choices firms and individual consumers make) and macroeconomics (the study of the economy as a whole). This course counts as a Group E economics course and is the prerequisite for 200-level E courses in the Economics Department.",Quantitative Thinking Q3
ECON 119-F1,10182,Principles of Economics,M W F,09:40 am-10:40 am,LIBR 250,Felix Friedt,0 / 17,"Economics is the study of how people make decisions and how these decisions apply to real-world problems. Economics can help us understand income inequality within and across countries, the quality of the environment, unemployment, poverty, crime, health care, financial crises, technological change, inflation and many more issues. This course introduces the basic tools that economists use to explore these topics and will cover fundamental economic concepts like scarcity, supply and demand, costs and benefits, trade-offs, and incentives. This course is a one semester overview of both microeconomics (the study of choices firms and individual consumers make) and macroeconomics (the study of the economy as a whole). This course counts as a Group E economics course and is the prerequisite for 200-level E courses in the Economics Department.",Quantitative Thinking Q3
ECON 129-F1,10188,Calculus-based Principles of Economics,M W F,10:50 am-11:50 am,CARN 304,Liang Ding,1 / 17,"An introduction to the basic tools of micro- and macroeconomic analysis in a math intensive way. Microeconomics deals with consumers, firms, markets and income distribution. Macroeconomics deals with national income, employment, inflation and money. Compared to ECON 119, this class requires calculus to learn economic models and conduct economic analysis, although the two classes cover the same economic concepts and theories. This course counts as a Group E elective. Prerequisite(s): MATH 135 or a qualifying AP Calculus score.","Writing WA
                    Quantitative Thinking Q3"
ECON 229-01,10189,World Economic History,M W F,01:10 pm-02:10 pm,CARN 305,Pete Ferderer,12 / 25,"This course presents a broad overview of world economic history. It uses concepts and models developed in Principles of Economics to explore how the interplay between geography, institutions, and technology has influenced material living standards from the Stone Age to the present. In particular, we will study the causes and consequences of long-term structural forces such as the agriculture, industrial and informational revolutions, the Malthusian trap and demographic transition, slavery, globalization, and the rise of government. We will also explore more cyclical phenomena such as wars, financial crises, economic depressions and hyper-inflations. Students will learn how economic historians use evidence to make sense of the past and the role economic history plays in guiding current policy debates. This course counts as a Group E elective. Prerequisite(s): ECON 119 or ECON 129. C- or higher required for all prerequisites.",Internationalism
ECON 229-02,10190,World Economic History,M W F,02:20 pm-03:20 pm,CARN 305,Pete Ferderer,18 / 25,"This course presents a broad overview of world economic history. It uses concepts and models developed in Principles of Economics to explore how the interplay between geography, institutions, and technology has influenced material living standards from the Stone Age to the present. In particular, we will study the causes and consequences of long-term structural forces such as the agriculture, industrial and informational revolutions, the Malthusian trap and demographic transition, slavery, globalization, and the rise of government. We will also explore more cyclical phenomena such as wars, financial crises, economic depressions and hyper-inflations. Students will learn how economic historians use evidence to make sense of the past and the role economic history plays in guiding current policy debates. This course counts as a Group E elective. Prerequisite(s): ECON 119 or ECON 129. C- or higher required for all prerequisites.",Internationalism
ECON 235-01,10242,"Climate Change: Science, Economics, and Policy",T R,09:40 am-11:10 am,OLRI 301,"Bradtmiller, West",8 / 25,"Combustion of fossil fuels produces carbon dioxide, which traps energy near Earth's surface and leads to warmer average global temperatures. Combustion of fossil fuels also forms the backbone of the modern economy. This team-taught course provides a framework in which to consider the costs and benefits of fossil fuel consumption in the present and over the coming decades and centuries. We use concepts from climate science and environmental economics to evaluate existing and proposed policy interventions designed to reduce fossil fuel consumption, and consider possible technological solutions to slow or reverse climate change. Among our main approaches are state-of-the-art Integrated Assessment Models; students will be exposed to several of the most commonly used models and to research from their critics. This course counts as a Group E elective. Students signing up for the course as Economics will get credit toward the social sciences general distribution requirement; those signing up for the course as Environmental Studies will get credit toward the natural sciences and mathematics general distribution requirement. Prerequisite(s): ECON 119 or ECON 129. C- or higher required for all prerequisites.",Quantitative Thinking Q3
ECON 238-01,10897,Introduction to Entrepreneurship,M,07:00 pm-10:00 pm,LIBR 250,Ali Alizadeh,-1 / 25,This course focuses on theories and applications of Entrepreneurship to identify opportunities and solve problems around the world. Students will learn contemporary methodologies used in startup companies and early stage organizations including: Lean Startup and Human Centered Design methodologies and the Business Model Canvas framework. Students spend the semester working in teams to apply the methodologies to identify a problem and develop a solution. For their final project students will prepare a plan for their solution and present it to an external audience. This course is open to those who are interested in social entrepreneurship as well. This course counts as a Group B elective. Note: Not available to students who took Social Entrepreneurship during the fall 2016 semester. Prerequisite(s): ECON 119 or ECON 129. C- or higher required for all prerequisites.,
ECON 239-01,10191,Global Food Problems,T R,01:20 pm-02:50 pm,CARN 304,Amy Damon, Closed 0 / 25,"This course will examine food distribution, production, policy, and hunger issues from an economics perspective. It explores and compares food and agriculture issues in both industrialized and developing countries. Basic economic tools will be applied to provide an analytical understanding of these issues. Topics such as hunger and nutrition, US farm policy, food distribution, food security, food aid, biotechnology and the Green Revolution, the connection between food production and health outcomes, as well as other related themes will be explored in depth throughout the semester. This course counts as a Group E elective. Prerequisite(s): ECON 119 or ECON 129. C- or higher required for all prerequisites.",
ECON 242-01,10983,Economics of Gender,M W F,09:40 am-10:40 am,CARN 304,Helen Scharber,12 / 25,"This course uses economic theory to explore how gender differences lead to different economic outcomes for men and women, both within families and in the marketplace. Topics include applications of economic theory to 1) aspects of family life including marriage, cohabitation, fertility, and divorce, and 2) the interactions of men and women in firms and in markets. The course will combine theory, empirical work, and analysis of economic policies that affect men and women differently. This course counts as a Group E elective. Prerequisite(s): ECON 119 or ECON 129. C- or higher required for all prerequisites.",
ECON 258-01,10804,Introduction to Securities Analysis,T R,01:20 pm-02:50 pm,OLRI 150,Joyce Minor,12 / 25,"This course will primarily focus on equity securities analysis (stocks) from the perspective of institutional (Wall Street) investors. Topics will include industry analysis and forecasting, financial statement analysis, fundamental company analysis and valuation methods. Students will form industry groups and will each research a company in that industry. Students will build complete historical and projected financial statement models in Excel. The end product of the course will be a company report written by each student. This course counts as a Group B elective. Prerequisite(s): ECON 113",
ECON 361-01,10194,Intermediate Microeconomic Analysis,T R,09:40 am-11:10 am,ARTCOM 202,Gabriel Lade,6 / 25,"In microeconomics, we study how individuals make economic choices. We pose questions like: What influences consumers' purchasing decisions? Will firms replace employees with machines if the minimum wage increases? How do concentrated markets (e.g., airlines, Amazon) affect consumers? If a firm can set different prices for different consumers, what set of prices will be optimal? How do risk and uncertainty affect investment decisions? What is the efficient amount of pollution? What role should governments play in providing resources for public goods like parks? In this course, we derive models of constrained choice to examine fundamental tradeoffs faced by individuals, firms, and governments when making economic decisions and to determine how such decisions influence market outcomes and well-being. This course counts as a Group E elective. Prerequisite(s): MATH 135 or MATH 137, and one 200-level Economics course from Group E electives. Not open to first-year students except by permission of the instructor. C- or higher required for all prerequisites.",Quantitative Thinking Q3
ECON 361-02,10195,Intermediate Microeconomic Analysis,T R,01:20 pm-02:50 pm,ARTCOM 202,Gabriel Lade, Closed 2 / 25,"In microeconomics, we study how individuals make economic choices. We pose questions like: What influences consumers' purchasing decisions? Will firms replace employees with machines if the minimum wage increases? How do concentrated markets (e.g., airlines, Amazon) affect consumers? If a firm can set different prices for different consumers, what set of prices will be optimal? How do risk and uncertainty affect investment decisions? What is the efficient amount of pollution? What role should governments play in providing resources for public goods like parks? In this course, we derive models of constrained choice to examine fundamental tradeoffs faced by individuals, firms, and governments when making economic decisions and to determine how such decisions influence market outcomes and well-being. This course counts as a Group E elective. Prerequisite(s): MATH 135 or MATH 137, and one 200-level Economics course from Group E electives. Not open to first-year students except by permission of the instructor. C- or higher required for all prerequisites.",Quantitative Thinking Q3
ECON 371-01,10196,Intermediate Macroeconomic Analysis,M W F,09:40 am-10:40 am,THEATR 213,Mario Solis-Garcia,17 / 25,"This course will introduce students to microeconomics based, dynamic general equilibrium models of the aggregate economy. These models will be used to address the three main questions of macroeconomics: What causes long-term economic growth to vary over time and across countries? Which forces drive fluctuations in economic activity and inflation throughout the business cycle? What role, if any, do monetary and fiscal policy play in fostering economic growth and minimizing economic fluctuations? This is one of the four courses required for the economics major. Prerequisite(s): ECON 361 or permission of instructor. C- or higher required for all prerequisites.",
ECON 371-02,10197,Intermediate Macroeconomic Analysis,M W F,10:50 am-11:50 am,THEATR 213,Mario Solis-Garcia,8 / 25,"This course will introduce students to microeconomics based, dynamic general equilibrium models of the aggregate economy. These models will be used to address the three main questions of macroeconomics: What causes long-term economic growth to vary over time and across countries? Which forces drive fluctuations in economic activity and inflation throughout the business cycle? What role, if any, do monetary and fiscal policy play in fostering economic growth and minimizing economic fluctuations? This is one of the four courses required for the economics major. Prerequisite(s): ECON 361 or permission of instructor. C- or higher required for all prerequisites.",
ECON 381-01,10198,Introduction to Econometrics,T R,09:40 am-11:10 am,THEATR 201,Amy Damon, Closed -3 / 22,"Econometrics is the theory and practice of analyzing economic data. We investigate and implement methods economists use to test theories, evaluate and establish causal inference, and conduct economic forecasts. Students learn to design, conduct, and evaluate empirical work in economics and other social sciences. We apply acquired skills through a final research project that integrates secondary research, economic theory, and econometric analysis. We take a ""hands on"" approach by practicing each week's material in the Economics Department's computer lab. This course counts as a Group E elective. Prerequisite(s): ECON 361; and one of the following: STAT 155 or GEOG 378 or PSYC 201. A grade of C- or higher required for all prerequisites.",Writing WA
ECON 381-02,10199,Introduction to Econometrics,T R,01:20 pm-02:50 pm,CARN 309,Gary Krueger,19 / 22,NA,NA
ECON 381-L1,10200,Intro to Econometrics Lab,W,12:00 pm-01:00 pm,CARN 309,Amy Damon, Closed -3 / 22,"Econometrics is the theory and practice of analyzing economic data. We investigate and implement methods economists use to test theories, evaluate and establish causal inference, and conduct economic forecasts. Students learn to design, conduct, and evaluate empirical work in economics and other social sciences. We apply acquired skills through a final research project that integrates secondary research, economic theory, and econometric analysis. We take a ""hands on"" approach by practicing each week's material in the Economics Department's computer lab. This course counts as a Group E elective. Prerequisite(s): ECON 361; and one of the following: STAT 155 or GEOG 378 or PSYC 201. A grade of C- or higher required for all prerequisites.",
ECON 381-L2,10201,Intro to Econometrics Lab,W,01:10 pm-02:20 pm,CARN 309,Gary Krueger,19 / 22,"Econometrics is the theory and practice of analyzing economic data. We investigate and implement methods economists use to test theories, evaluate and establish causal inference, and conduct economic forecasts. Students learn to design, conduct, and evaluate empirical work in economics and other social sciences. We apply acquired skills through a final research project that integrates secondary research, economic theory, and econometric analysis. We take a ""hands on"" approach by practicing each week's material in the Economics Department's computer lab. This course counts as a Group E elective. Prerequisite(s): ECON 361; and one of the following: STAT 155 or GEOG 378 or PSYC 201. A grade of C- or higher required for all prerequisites.",
ECON 421-01,10202,International Trade and Multinational Corporations,M W F,02:20 pm-03:20 pm,THEATR 213,Felix Friedt,12 / 25,"Multinational corporations are a primary driver of the rapid globalization of the world economy that we have witnessed in the past couple of decades. This course is comprised of two primary elements: 1) a theoretical component that introduces the more advanced theories of international trade and foreign direct investment (FDI) and 2) an applied component that discusses the role of multinational corporations and exporters in shaping globalization. The theories developed in this class expose students to the current paradigm in the international trade and FDI literatures focused on heterogeneous firm-level analysis. These derivations provide a sound platform from which to evaluate the causes and consequences of international trade and FDI and provide a natural transition for contemplating the role of exporting firms and multinational corporations in shaping globalization. Throughout this applied component of the course, we will examine issues, such as the role of productivity and diversity in entering foreign markets, the labor market effects in home and host countries, the correlation with economic development and inequality, convergence or polarization of global cultures, and issues related to international trade policy and transportation. This course counts as a Group E elective. It is a capstone course. Prerequisite(s): ECON 361, ECON 371 and ECON 381, all earned with a minimum grade of C-.","Writing WP
                    Quantitative Thinking Q3"
ECON 444-01,10203,Honors Seminar,T R,03:00 pm-04:30 pm,CARN 309,Gary Krueger,4 / 15,An honors seminar to enhance the senior capstone requirement. This course counts as a Group E elective. It is a capstone course. Prerequisite(s): Permission of instructor required.,
ECON 457-01,10204,Finance,M W F,01:10 pm-02:10 pm,CARN 206,Liang Ding,4 / 25,"This course concentrates on developing and applying economic principles to the decision making process of the firm. Typically the course is taught from the viewpoint of the financial manager of a firm (profit or non-profit). Traditional corporate finance topics will be covered, including: cash flow management, sources of capital, capital budgeting, cost of capital, and financial structure. Recent theoretical developments in the capital asset pricing model and portfolio theory also will be examined. Actual case studies of financial decision making often are included in the course.  This course counts as a Group E elective. Prerequisite(s): ECON 113, ECON 361 and ECON 381. C- or higher required for all prerequisites.",
