number,crn,name,days,time,room,instructor,avail_max,desc,gen_ed
GEOL 160-01,10314,Dynamic Earth/Global Change,M W F,10:50 am-11:50 am,OLRI 100,Alan Chapman,9 / 48,This course provides an introduction to the materials and structure of the Earth and to the processes acting on and in the Earth to produce change. Emphasis is placed on the evolution of landforms and the formation of Earth resources. Discussions focus on the important role of geologic processes in the solution of environmental problems. Required for geology majors. Local field trips. Three hours lecture and two hours lab per week.,Quantitative Thinking Q2
GEOL 160-L1,10315,Dynamic Earth/Global Chg Lab,R,01:20 pm-04:30 pm,OLRI 187,Alan Chapman,-1 / 16,This course provides an introduction to the materials and structure of the Earth and to the processes acting on and in the Earth to produce change. Emphasis is placed on the evolution of landforms and the formation of Earth resources. Discussions focus on the important role of geologic processes in the solution of environmental problems. Required for geology majors. Local field trips. Three hours lecture and two hours lab per week.,
GEOL 160-L2,10316,Dynamic Earth/Global Chg Lab,T,08:00 am-11:10 am,OLRI 187,Jeffrey Thole,4 / 24,This course provides an introduction to the materials and structure of the Earth and to the processes acting on and in the Earth to produce change. Emphasis is placed on the evolution of landforms and the formation of Earth resources. Discussions focus on the important role of geologic processes in the solution of environmental problems. Required for geology majors. Local field trips. Three hours lecture and two hours lab per week.,
GEOL 160-L3,10317,Dynamic Earth/Global Chg Lab,T,01:20 pm-04:30 pm,OLRI 187,Jeffrey Thole,5 / 24,This course provides an introduction to the materials and structure of the Earth and to the processes acting on and in the Earth to produce change. Emphasis is placed on the evolution of landforms and the formation of Earth resources. Discussions focus on the important role of geologic processes in the solution of environmental problems. Required for geology majors. Local field trips. Three hours lecture and two hours lab per week.,
GEOL 160-F1,10313,Dynamic Earth/Global Change,M W F,12:00 pm-01:00 pm,OLRI 187,Alan Chapman,0 / 17,This course provides an introduction to the materials and structure of the Earth and to the processes acting on and in the Earth to produce change. Emphasis is placed on the evolution of landforms and the formation of Earth resources. Discussions focus on the important role of geologic processes in the solution of environmental problems. Required for geology majors. Local field trips. Three hours lecture and two hours lab per week.,"Writing WA
                    Quantitative Thinking Q2"
GEOL 194-01,10803,Geology of National Parks,M W F,01:10 pm-02:10 pm,OLRI 100,Samuel Matson, Closed 1 / 48,"Geology is the scientific study of the Earth system at various scales of time and space. The Earth is a constantly changing body; while many of these changes take place on time scales that are too long for most people to recognize, they nonetheless have a significant impact on our everyday lives. The U.S. National Park system is a medium through which many people first encounter and appreciate the dynamic Earth system. In this course, students will explore the past and present Earth system processes responsible for the landscapes and ecosystems of the diverse U.S. National Parks. Specific topics this course will address include plate tectonics, the rock cycle, surface processes (e.g., weathering, rivers, glaciers), natural hazards (e.g., volcanoes, earthquakes, landslides), Earth history, and past and current impacts of climate on the Earth system.",
GEOL 260-01,10320,Geomorphology,M W F,10:50 am-11:50 am,OLRI 175,Kelly MacGregor,7 / 18,"Geomorphology is the study of physical, chemical, and biological processes that occur on the surface of a planetary body. We will be examining the processes that turn solid rock into transportable material, the transport mechanisms themselves (whether beneath glaciers, down hillslopes, or in rivers), and the patterns of deposition, many of which are unique to the processes that created them. These processes range from the very large (volcanism and mountain-building) to the microscopic (frost cracking of rock, soil creep, and chemical weathering along mineralogic grain boundaries). Some processes occur frequently across geographic boundaries and throughout geologic time (like rainsplash), while others are stochastic in nature and dramatic in their geomorphic signature (like glacial outburst floods). We will focus on the roles of rivers, glaciers, and mass movements in shaping landscapes, but will examine wide-ranging landscapes such as arid environments and coastal regions. The study of current surface processes on the Earth will be examined with an eye toward understanding the evolution of landscapes over geologic timescales. Prerequisite(s): GEOL 160  or GEOL 165 or permission of instructor.",Quantitative Thinking Q2
GEOL 260-L1,10321,Geomorphology Lab,T,08:00 am-11:10 am,OLRI 175,Kelly MacGregor,7 / 18,"Geomorphology is the study of physical, chemical, and biological processes that occur on the surface of a planetary body. We will be examining the processes that turn solid rock into transportable material, the transport mechanisms themselves (whether beneath glaciers, down hillslopes, or in rivers), and the patterns of deposition, many of which are unique to the processes that created them. These processes range from the very large (volcanism and mountain-building) to the microscopic (frost cracking of rock, soil creep, and chemical weathering along mineralogic grain boundaries). Some processes occur frequently across geographic boundaries and throughout geologic time (like rainsplash), while others are stochastic in nature and dramatic in their geomorphic signature (like glacial outburst floods). We will focus on the roles of rivers, glaciers, and mass movements in shaping landscapes, but will examine wide-ranging landscapes such as arid environments and coastal regions. The study of current surface processes on the Earth will be examined with an eye toward understanding the evolution of landscapes over geologic timescales. Prerequisite(s): GEOL 160  or GEOL 165 or permission of instructor.",
GEOL 265-01,10318,Sedimentology/Stratigraphy,M W F,12:00 pm-01:00 pm,OLRI 175,Samuel Matson,11 / 18,"This course focuses on sedimentary rocks and the stratigraphic record. Topics covered include the origin and classification of sediments and sedimentary rocks (siliciclatic and carbonate), sedimentary structures (physical and biogenic), diagenesis, facies models, and basin analysis. Students are introduced to the principles and practice of stratigraphy. Emphasis is placed on the interpretation of ancient sedimentary environments. Three hours lecture and three hours lab per week. Field trips. Prerequisite(s): GEOL 160, GEOL 165, and GEOL 250; or permission of the instructor.",
GEOL 265-L1,10319,Sedimentology/Strat Lab,R,01:20 pm-04:30 pm,OLRI 175,Samuel Matson,11 / 18,"This course focuses on sedimentary rocks and the stratigraphic record. Topics covered include the origin and classification of sediments and sedimentary rocks (siliciclatic and carbonate), sedimentary structures (physical and biogenic), diagenesis, facies models, and basin analysis. Students are introduced to the principles and practice of stratigraphy. Emphasis is placed on the interpretation of ancient sedimentary environments. Three hours lecture and three hours lab per week. Field trips. Prerequisite(s): GEOL 160, GEOL 165, and GEOL 250; or permission of the instructor.",
GEOL 294-01,10042,Land/Water,M W,08:00 am-09:30 am,ART 308,"MacGregor, Willcox", Closed 0 / 22,"This course will be comprised of both lecture-based and on-site components, and course material will guide students through the historical and contemporary examples of Landscape as a site for scientific and artistic investigation and exploration. Within the broad topic of Landscape, faculty will cover the sub topic of water and how the scientific research and art practice around the topic have led to a greater cultural and political understanding of how water is seen as a resource and site of inspiration. Topics related to the theme of water will include climate change, flooding, the global refugee crisis, migration, the Atlantic slave trade, and human manipulation of water-rich and arid region landscapes, among others.  The course will include multiple local outdoor field trips and an overnight trip (either camping or in a rustic environmental learning center), where students will take field measurements, work in their nature journals where they will sketch, paint and learn to visually explore the natural world. These journals will also reflect the scientific practice of field note-taking and data gathering. Students will also use low-stakes writing to demonstrate knowledge and explore connections, especially across disciplinary boundaries.  We will also explore the methodologies used to gain knowledge in art and science, and consider advantages and challenges to taking multi-disciplinary approaches to exploring landscapes. Readings will come from a wide range of disciplines, including scientific and nature writings, creative writing, journalism/news stories, and creative critiques.  Students will learn about how science and art have successfully brought the natural world into focus over the last centuries and while the methodologies of the two disciplines vary, taken together, they can enhance our understanding of numerous topics that are socially, politically and culturally relevant today.",
GERM 101-01,10322,Elementary German I,M W F,01:10 pm-02:10 pm,HUM 213,Brigetta Abel,6 / 20,"Emphasizing the active use of the language, this course focuses on vocabulary and structural acquisition as a way to develop elementary proficiency in speaking, reading, writing, and comprehension. Students both develop facility with German in highly structured contexts through work with authentic texts and become familiar with a variety of contemporary German-speaking cultures. Students will work with an open educational resource for this course: an interactive, online, and free textbook designed to meet the learning needs of Macalester students. For beginning students with no previous German language instruction. Three hours per week plus laboratory conversation hour.",
GERM 101-L1,10323,Elementary German I Lab,R,03:30 pm-04:30 pm,HUM 102,Amanda Wolfson,8 / 12,"Emphasizing the active use of the language, this course focuses on vocabulary and structural acquisition as a way to develop elementary proficiency in speaking, reading, writing, and comprehension. Students both develop facility with German in highly structured contexts through work with authentic texts and become familiar with a variety of contemporary German-speaking cultures. Students will work with an open educational resource for this course: an interactive, online, and free textbook designed to meet the learning needs of Macalester students. For beginning students with no previous German language instruction. Three hours per week plus laboratory conversation hour.",
GERM 101-L2,10324,Elementary German I Lab,R,02:20 pm-03:20 pm,OLRI 250,Amanda Wolfson,2 / 12,"Emphasizing the active use of the language, this course focuses on vocabulary and structural acquisition as a way to develop elementary proficiency in speaking, reading, writing, and comprehension. Students both develop facility with German in highly structured contexts through work with authentic texts and become familiar with a variety of contemporary German-speaking cultures. Students will work with an open educational resource for this course: an interactive, online, and free textbook designed to meet the learning needs of Macalester students. For beginning students with no previous German language instruction. Three hours per week plus laboratory conversation hour.",
GERM 101-L3,11056,Elementary German I Lab,R,08:00 am-09:00 am,HUM 113,STAFF,10 / 10,"Emphasizing the active use of the language, this course focuses on vocabulary and structural acquisition as a way to develop elementary proficiency in speaking, reading, writing, and comprehension. Students both develop facility with German in highly structured contexts through work with authentic texts and become familiar with a variety of contemporary German-speaking cultures. Students will work with an open educational resource for this course: an interactive, online, and free textbook designed to meet the learning needs of Macalester students. For beginning students with no previous German language instruction. Three hours per week plus laboratory conversation hour.",
GERM 110-01,10325,Accelerated Elementary German,M W F,10:50 am-11:50 am,MUSIC 228,Michael Powers,6 / 20,"A five-credit accelerated course which covers the content and proficiency development normally covered in GERM 101 and GERM 102. The course, with a separate curriculum for easy independent work, is for students with prior experience with German who need a concentrated review or for students with previous other foreign language background who wish to work at an accelerated pace. Three hours per week plus two conversation laboratory hours. During Spring semester there will be an optional reading and translation lab.",
GERM 110-L1,10326,Accel Elementary German Lab,M W,03:30 pm-04:30 pm,HUM 215,Amanda Wolfson,0 / 12,"A five-credit accelerated course which covers the content and proficiency development normally covered in GERM 101 and GERM 102. The course, with a separate curriculum for easy independent work, is for students with prior experience with German who need a concentrated review or for students with previous other foreign language background who wish to work at an accelerated pace. Three hours per week plus two conversation laboratory hours. During Spring semester there will be an optional reading and translation lab.",
GERM 110-L2,10327,Accel Elementary German Lab,TBA,TBA,,Amanda Wolfson,10 / 12,"A five-credit accelerated course which covers the content and proficiency development normally covered in GERM 101 and GERM 102. The course, with a separate curriculum for easy independent work, is for students with prior experience with German who need a concentrated review or for students with previous other foreign language background who wish to work at an accelerated pace. Three hours per week plus two conversation laboratory hours. During Spring semester there will be an optional reading and translation lab.",
GERM 174-F1,10328,Vampires - from Monsters to Superheroes,M W F,10:50 am-11:50 am,HUM 216,Brigetta Abel,0 / 17,"Vampires are cyclical. Just a few years ago you ran into them anytime you walked into a bookstore or turned on the TV-just like in Victorian times when Bram Stoker's famous work emerged from a vampire craze. Vampires have always been popular fodder and will continue to be so, even if and as the image of the vampire shifts dramatically over time. The popularity of vampires has waxed and waned for over a hundred years, partially because vampirism can be used as a metaphor for almost anything-from the plague to sexuality to addiction. We will juxtapose classic tales of vampires as monsters with the more recent generation of vampires. What happened to change our imagination of vampires from monsters into hip, outsider superheroes? And what can the examination of vampires tell us about the context in which they were created?",Writing WA
GERM 194-F1,10329,Marx and Art,M W F,09:40 am-10:40 am,HUM 302,Michael Powers,0 / 16,"Karl Marx revolutionized how we think about power and capitalism. But what is the role of art for Marx and later Marxists? What is art’s revolutionary potential? Should art be political, and if so, how? In this discussion-based course, we will examine how artists and intellectuals have grappled with these issues in light of Marx’s insights into the relation between power, ideology, and consciousness. Guided by introductory readings in Marxist philosophy and art theory, we will explore literary and visual artworks, from socialist fairy tales, avant-garde poetry and theater, to street murals, performance art, and film. Sample discussion topics include: labor, alienation, and modern technology; perception and the politics of the senses; global capitalism and colonialism; and revolutionary and utopian thought.",Writing WA
GERM 203-01,10330,Intermediate German I,M W F,09:40 am-10:40 am,HUM 214,Amanda Wolfson,6 / 20,"This course is designed to help students increase their proficiency in the German language while emphasizing authentic cultural contexts. Through exposure to a variety of texts and text types, students develop oral and written proficiency in description and narration and develop tools and discourse strategies for culturally authentic interaction with native speakers. Cultural topics are expanded and deepened. Three hours per week plus conversation laboratory hour. Prerequisite(s): GERM 102  or GERM 110  with a grade of C- or better, or placement test, or consent of the instructor.",
GERM 203-L1,10331,Intermediate German I Lab,T,09:00 am-10:00 am,HUM 228,Amanda Wolfson,3 / 12,"This course is designed to help students increase their proficiency in the German language while emphasizing authentic cultural contexts. Through exposure to a variety of texts and text types, students develop oral and written proficiency in description and narration and develop tools and discourse strategies for culturally authentic interaction with native speakers. Cultural topics are expanded and deepened. Three hours per week plus conversation laboratory hour. Prerequisite(s): GERM 102  or GERM 110  with a grade of C- or better, or placement test, or consent of the instructor.",
GERM 203-L2,10332,Intermediate German I Lab,T,03:30 pm-04:30 pm,HUM 214,Amanda Wolfson,7 / 12,"This course is designed to help students increase their proficiency in the German language while emphasizing authentic cultural contexts. Through exposure to a variety of texts and text types, students develop oral and written proficiency in description and narration and develop tools and discourse strategies for culturally authentic interaction with native speakers. Cultural topics are expanded and deepened. Three hours per week plus conversation laboratory hour. Prerequisite(s): GERM 102  or GERM 110  with a grade of C- or better, or placement test, or consent of the instructor.",
GERM 204-01,10333,Intermediate German II,M W F,10:50 am-11:50 am,HUM 214,Amanda Wolfson,2 / 20,"The course aims to help students attain a comfort level with extended discourse in German within culturally appropriate contexts. Students develop the ability to comprehend authentic spoken German on a variety of topics at length. They develop effective strategies for comprehending a variety of texts and text types. They gain increased facility with extended discourse, such as narrating and describing. Writing in German is also developed so that students can write extensively about familiar topics. Three hours per week plus laboratory conversation hour. Prerequisite(s): GERM 203  with a grade of C- or better, or placement test, or consent of the instructor.",
GERM 204-L1,10334,Intermediate German II Lab,R,09:00 am-10:00 am,HUM 228,Amanda Wolfson,2 / 12,"The course aims to help students attain a comfort level with extended discourse in German within culturally appropriate contexts. Students develop the ability to comprehend authentic spoken German on a variety of topics at length. They develop effective strategies for comprehending a variety of texts and text types. They gain increased facility with extended discourse, such as narrating and describing. Writing in German is also developed so that students can write extensively about familiar topics. Three hours per week plus laboratory conversation hour. Prerequisite(s): GERM 203  with a grade of C- or better, or placement test, or consent of the instructor.",
GERM 204-L2,10335,Intermediate German II Lab,W,02:20 pm-03:20 pm,HUM 113,Amanda Wolfson,4 / 12,"The course aims to help students attain a comfort level with extended discourse in German within culturally appropriate contexts. Students develop the ability to comprehend authentic spoken German on a variety of topics at length. They develop effective strategies for comprehending a variety of texts and text types. They gain increased facility with extended discourse, such as narrating and describing. Writing in German is also developed so that students can write extensively about familiar topics. Three hours per week plus laboratory conversation hour. Prerequisite(s): GERM 203  with a grade of C- or better, or placement test, or consent of the instructor.",
GERM 275-01,10341,Theoretical Approaches to European and American Cinema,T R,01:20 pm-02:50 pm,HUM 401,Kiarina Kordela,10 / 25,"All readings and class taught in English; no pre-knowledge required. In this course we shall approach films as a medium that, through all of its means (from dialogue to more formal aspects, such as camera angle or editing), raises and attempts to negotiate philosophical, ideological, and political issues and conflicts. We shall be exposed to different methodologies of film analysis while examining: (a) a few representative films of three influential European film movements (German expressionism, Italian Neo-Realism, French nouvelle-vague), as a means of tracing the itinerary of European cinema from an action-oriented to a reflection-oriented practice; (b) the British and later American work of Alfred Hitchcock, as a mode of cinematography that employs the ""gaze"" as a principle of structural organization; and (c), American films of the 1970's - 1990's, as attempts to represent the world of late capitalism.",Internationalism
GERM 294-01,10336,Freedom and its Discontents,T R,09:40 am-11:10 am,HUM 213,David Martyn,2 / 25,"“Free choice is the only miracle the moderns recognize” (Karol Berger). Freedom currently occupies an ambiguous place in our collective state of mind: while the Right takes to the streets in the name of freedom, MLK’s ringing refrain, “free at last,” continues to resonate in the Left’s calls for social justice. Both camps typically rely on the same underlying concept of what freedom is: something an individual exercises with their free will. In this course, we will work to gain a measure of distance on this common view of freedom by counterposing it with premodern as well as modern strains of thought that go against the grain of classical liberalism. Readings from Aristotle, Locke, Kant, Hegel, Marx, Nietzsche, Freud, Arendt, Buck-Morss, Mbembe, Badiou, Ahmad Yousif, and others. Weekly reading responses; three mid-length papers with revisions. No prerequisites, but be prepared to work your way through some densely argued texts.",Writing WA
GERM 308-01,10338,German Cultural History I: Uniting and Dividing Germany,T R,03:00 pm-04:30 pm,HUM 401,Kiarina Kordela,7 / 20,"This course prepares students with intermediate German language skills for upper-level courses in German Studies through advanced language instruction combined with a critical investigation of important political, social, and aesthetic topics in German cultural history. These topics may include the Wars of Liberation against Napoleon (1813-1815), the 1848 European revolution, the impact of industrialization, the foundation of the German Reich (1870/1871), the economics and philosophical critique offered by socialism, the feminist movement, imperialism and WWI (1914-1918), the aesthetic revolution of modernism in the arts, and the beginning of the Weimar Republic (1918-1933). In the late part of the course, we shall also introduce ourselves to aspects of living on the East side of the wall dividing Berlin (1961-1989). In addition to historical sources, we shall read literary texts and view art and films relating to these topics. Taught in German. Three hours per week plus one hour of intensive language practice. Prerequisite(s): GERM 204 or permission of instructor.","Writing WA
                    Internationalism"
GERM 308-L1,10339,German Cultural History I Lab,T,10:10 am-11:10 am,HUM 228,Amanda Wolfson,6 / 12,"This course prepares students with intermediate German language skills for upper-level courses in German Studies through advanced language instruction combined with a critical investigation of important political, social, and aesthetic topics in German cultural history. These topics may include the Wars of Liberation against Napoleon (1813-1815), the 1848 European revolution, the impact of industrialization, the foundation of the German Reich (1870/1871), the economics and philosophical critique offered by socialism, the feminist movement, imperialism and WWI (1914-1918), the aesthetic revolution of modernism in the arts, and the beginning of the Weimar Republic (1918-1933). In the late part of the course, we shall also introduce ourselves to aspects of living on the East side of the wall dividing Berlin (1961-1989). In addition to historical sources, we shall read literary texts and view art and films relating to these topics. Taught in German. Three hours per week plus one hour of intensive language practice. Prerequisite(s): GERM 204 or permission of instructor.",
