number,crn,name,days,time,room,instructor,avail_max,desc,gen_ed
PHYS 126-L1,10518,Introductory Physics I Lab,T,08:00 am-11:10 am,OLRI 152,Brian Adams,2 / 18,"Mechanics, heat and sound, including laboratory experiments and demonstrations. This course does not use calculus, has no prerequisites, and is appropriate for students pursuing pre-med or for students looking to satisfy a science distribution requirement.  This course does not count toward the physics major or minor.  This course is not appropriate for students who intend to major in physics, chemistry, or biology with the biochemistry emphasis.",
PHYS 126-L2,10519,Introductory Physics I Lab,T,01:20 pm-04:30 pm,OLRI 152,Brian Adams,1 / 18,"Mechanics, heat and sound, including laboratory experiments and demonstrations. This course does not use calculus, has no prerequisites, and is appropriate for students pursuing pre-med or for students looking to satisfy a science distribution requirement.  This course does not count toward the physics major or minor.  This course is not appropriate for students who intend to major in physics, chemistry, or biology with the biochemistry emphasis.",
PHYS 194-F1,10516,Nanoscience,M W F,12:00 pm-01:00 pm,OLRI 150,James Heyman,0 / 17,Varies by semester. Consult the department or class schedule for current listing.,"Writing WA
                    Quantitative Thinking Q1"
PHYS 226-01,10520,Principles of Physics I,M W F,09:40 am-10:40 am,OLRI 100,Christopher West,7 / 36,"A study of motion, including Newton's Law of Motion, conservation of energy and momentum, rotational kinematics and dynamics, oscillations, waves in elastic media and thermal properties of matter. Three lectures and one two-hour laboratory per week. Students cannot receive credit for both this course and PHYS 221. Prerequisite(s): Concurrent or previous registration in MATH 135 or MATH 137; or a 4 or 5 on the Advanced Placement AB or BC Calculus exam.",Quantitative Thinking Q2
PHYS 226-L1,10521,Principles of Physics I Lab,M,02:20 pm-04:20 pm,OLRI 152,Brian Adams,3 / 18,"A study of motion, including Newton's Law of Motion, conservation of energy and momentum, rotational kinematics and dynamics, oscillations, waves in elastic media and thermal properties of matter. Three lectures and one two-hour laboratory per week. Students cannot receive credit for both this course and PHYS 221. Prerequisite(s): Concurrent or previous registration in MATH 135 or MATH 137; or a 4 or 5 on the Advanced Placement AB or BC Calculus exam.",
PHYS 226-L2,10522,Principles of Physics I Lab,M,07:00 pm-09:00 pm,OLRI 152,Brian Adams,4 / 18,"A study of motion, including Newton's Law of Motion, conservation of energy and momentum, rotational kinematics and dynamics, oscillations, waves in elastic media and thermal properties of matter. Three lectures and one two-hour laboratory per week. Students cannot receive credit for both this course and PHYS 221. Prerequisite(s): Concurrent or previous registration in MATH 135 or MATH 137; or a 4 or 5 on the Advanced Placement AB or BC Calculus exam.",
PHYS 227-01,10523,Principles of Physics II,M W F,08:30 am-09:30 am,OLRI 150,Christopher West,30 / 36,"A study of electric charge and currents, electric and magnetic fields, electromagnetic waves, and geometrical and physical optics. Three lectures and one two-hour laboratory per week. Students cannot receive credit for both this course and PHYS 222. Prerequisite(s): PHYS 226  and MATH 137  (MATH 137 may also be taken concurrently).",Quantitative Thinking Q3
PHYS 227-L1,10524,Principles of Physics II Lab,R,09:10 am-11:10 am,OLRI 152,Brian Adams,13 / 18,"A study of electric charge and currents, electric and magnetic fields, electromagnetic waves, and geometrical and physical optics. Three lectures and one two-hour laboratory per week. Students cannot receive credit for both this course and PHYS 222. Prerequisite(s): PHYS 226  and MATH 137  (MATH 137 may also be taken concurrently).",
PHYS 227-L2,10525,Principles of Physics II Lab,R,01:20 pm-03:20 pm,OLRI 152,Brian Adams,17 / 18,"A study of electric charge and currents, electric and magnetic fields, electromagnetic waves, and geometrical and physical optics. Three lectures and one two-hour laboratory per week. Students cannot receive credit for both this course and PHYS 222. Prerequisite(s): PHYS 226  and MATH 137  (MATH 137 may also be taken concurrently).",
PHYS 331-01,10526,Modern Physics,M W F,08:30 am-09:30 am,OLRI 100,James Heyman,7 / 24,"This course provides an introductory treatment of the exciting foundations of modern microscopic physics, including special relativity, quantum theory, atomic structure, nuclear structure and elementary particles. The primary goal of the course is to build the solid theoretical foundation in microscopic physics necessary for advanced studies in nearly all science disciplines. In addition to the theoretical treatment of the topics there will be laboratory exercises, which recreate the spirit and excitement of the pioneering experiments. Three lectures, one three-hour laboratory per week. Prerequisite(s): PHYS 227.",Quantitative Thinking Q2
PHYS 331-L1,10527,Modern Physics Lab,R,08:00 am-11:10 am,OLRI 154,James Heyman,3 / 12,"This course provides an introductory treatment of the exciting foundations of modern microscopic physics, including special relativity, quantum theory, atomic structure, nuclear structure and elementary particles. The primary goal of the course is to build the solid theoretical foundation in microscopic physics necessary for advanced studies in nearly all science disciplines. In addition to the theoretical treatment of the topics there will be laboratory exercises, which recreate the spirit and excitement of the pioneering experiments. Three lectures, one three-hour laboratory per week. Prerequisite(s): PHYS 227.",
PHYS 331-L2,10528,Modern Physics Lab,R,01:20 pm-04:30 pm,OLRI 154,James Heyman,4 / 12,"This course provides an introductory treatment of the exciting foundations of modern microscopic physics, including special relativity, quantum theory, atomic structure, nuclear structure and elementary particles. The primary goal of the course is to build the solid theoretical foundation in microscopic physics necessary for advanced studies in nearly all science disciplines. In addition to the theoretical treatment of the topics there will be laboratory exercises, which recreate the spirit and excitement of the pioneering experiments. Three lectures, one three-hour laboratory per week. Prerequisite(s): PHYS 227.",
PHYS 350-01,10529,Energy and Sustainable Design,M W F,12:00 pm-01:00 pm,OLRI 101,James Doyle,13 / 18,"This course provides an in-depth treatment of the science and engineering the transition to a sustainable, renewable, and carbon-free energy economy.  The first part of the course will be a survey of the electric power grid transition to wind, solar, storage and other renewable technologies.  The focus of the course will examine carbon-free and sustainable practices and technologies in the built environment including electrification of transportation and heating, distributed energy and energy storage, micro grids, efficiency, water and waste management, and sustainable building design practices.    An important theme of the course will be the implications of deep electrification, where the energy economy is based almost exclusively on electrical energy generated by carbon-free and renewable resources.   Lab time will be used for local field trips, computer simulations, and laboratory demonstrations/experiments.  Three lectures and one two hour lab per week. Prerequisite(s): Mathematics preparation though elementary calculus (equivalent to MATH 135)",Quantitative Thinking Q2
PHYS 350-L1,10531,Energy and Sustainable Design,T,01:20 pm-03:20 pm,OLRI 154,James Doyle,13 / 18,"This course provides an in-depth treatment of the science and engineering the transition to a sustainable, renewable, and carbon-free energy economy.  The first part of the course will be a survey of the electric power grid transition to wind, solar, storage and other renewable technologies.  The focus of the course will examine carbon-free and sustainable practices and technologies in the built environment including electrification of transportation and heating, distributed energy and energy storage, micro grids, efficiency, water and waste management, and sustainable building design practices.    An important theme of the course will be the implications of deep electrification, where the energy economy is based almost exclusively on electrical energy generated by carbon-free and renewable resources.   Lab time will be used for local field trips, computer simulations, and laboratory demonstrations/experiments.  Three lectures and one two hour lab per week. Prerequisite(s): Mathematics preparation though elementary calculus (equivalent to MATH 135)",
PHYS 443-01,10533,Electromagnetic Theory,M W F,01:10 pm-02:10 pm,OLRI 101,Saki Khan,11 / 24,"This course treats the interactions between electrical charges in free space by developing the concepts of potential, electric and magnetic fields, and electromagnetic induction. Maxwell's equations are developed and used to derive the properties of plane electromagnetic waves in free space. Special emphasis is placed on boundary value problems and other useful mathematical techniques. Three lectures, 1 one-hour laboratory per week. Prerequisite(s): PHYS 227 and MATH 237 .",
PHYS 443-L1,10534,Electromagnetic Theory Lab,M,03:30 pm-04:30 pm,OLRI 154,James Doyle,11 / 24,"This course treats the interactions between electrical charges in free space by developing the concepts of potential, electric and magnetic fields, and electromagnetic induction. Maxwell's equations are developed and used to derive the properties of plane electromagnetic waves in free space. Special emphasis is placed on boundary value problems and other useful mathematical techniques. Three lectures, 1 one-hour laboratory per week. Prerequisite(s): PHYS 227 and MATH 237 .",
PHYS 481-01,10535,Quantum Mechanics,M W F,02:20 pm-03:20 pm,OLRI 100,Christopher West,18 / 24,"The course rigorously covers many fundamental concepts of non-relativistic quantum mechanics, including the Heisenberg uncertainty principle and Pauli exclusion principle, single- and multi-particle stationary states in one, two, and three dimensions, and quantized angular momentum and spin. Schrodinger equation solutions for atomic and nuclear systems are studied, using differential equation, matrix, and perturbation techniques. Three lectures, 1 one-hour laboratory per week. Prerequisite(s): PHYS 331 and MATH 312 .",
PHYS 481-L1,10536,Quantum Mechanics Lab,F,03:30 pm-04:30 pm,OLRI 154,Saki Khan,18 / 24,"The course rigorously covers many fundamental concepts of non-relativistic quantum mechanics, including the Heisenberg uncertainty principle and Pauli exclusion principle, single- and multi-particle stationary states in one, two, and three dimensions, and quantized angular momentum and spin. Schrodinger equation solutions for atomic and nuclear systems are studied, using differential equation, matrix, and perturbation techniques. Three lectures, 1 one-hour laboratory per week. Prerequisite(s): PHYS 331 and MATH 312 .",
PHYS 489-01,10537,Physics Seminar,W,03:30 pm-04:30 pm,OLRI 150,James Doyle,34 / 63,,
POLI 100-01,10538,Foundations of US Politics,M W F,09:40 am-10:40 am,CARN 206,Della Zurick,4 / 25,"This course introduces the constitutional framework, political culture, branches of government, political behavior, and nongovernmental institutions (e.g. political parties, media, or interest groups) that dynamically shape American politics.  Approaches vary by instructor, potentially including some mix of simulations, class debates, offsite observations, and comparative and critical examinations, but share a common set of objectives: 1) cultivating a broad and conversational understanding of key ideas, issues, and problems particular to American politics through classic and contemporary readings; 2) stimulating further inquiry into how American politics works and why it matters and 3) developing students' own reasoning, critical thinking, writing, and public speaking skills. This course is principally designed for beginning political science majors and non-majors who have not taken an AP course in US Government and Politics.",
POLI 120-01,10539,Foundations of International Politics,T R,01:20 pm-02:50 pm,OLRI 350,Bora Jeong,0 / 25,"This course has three broad goals. The first is to develop the foundational knowledge and conceptual literacy necessary to engage with International Relations' multidimensional concerns. These include issues such as world order, power, hierarchy, political violence, international law, development, religion, human rights, gender, humanitarianism and international organizations (such as the United Nations). The second is to introduce students to the different perspectives or intellectual frameworks for making sense of international relations (also known as global or world politics), including realist, liberal, constructivist, historical materialist, postcolonial and feminist approaches. The third is to encourage students to reflect on some of the ethical issues inherent in both the study and practice of international politics. Emphasis will also be placed on developing a range of critical, analytical, research and writing skills required for the further study of international politics. The course is thus intended to prepare students for advanced work in the field, although it is also appropriate for those merely seeking to satisfy an interest in the study of global politics.",Internationalism
POLI 140-01,10540,Foundations of Comparative Politics,T R,01:20 pm-02:50 pm,LIBR 250,Paul Dosh,0 / 20,"In Comparative Politics we use comparison to analyze political outcomes within and across countries, Why do Mexican presidents exercise strong centralized authority while Brazilian presidents must contend with powerful governors? Why do Muslims and Hindus fight in some Indian states but not in others? Why does Rwanda have such a high proportion of female legislators whereas the U.S. has such a low proportion? When confronted with large-scale protests in their cities, do state security forces in China, Russia, and the United States respond with similar methods or do they differ? Through comparative analysis, students will learn to describe diverse political institutions, to propose explanations for divergent outcomes, and to evaluate scholarly and popular arguments about politics.","Writing WA
                    Internationalism"
POLI 160-01,10541,Foundations of Political Theory,T R,09:40 am-11:10 am,CARN 06A,Della Zurick,1 / 25,"An examination of the evolution of influential political concepts and theories from ancient cultures to the present day, by those writing in/from/to the West. Introduction through textual analysis to historical and contemporary understandings of key terms such as authority, legitimacy, liberty, republicanism, democracy, revolution and ""the good."" Additionally, the course provides an introduction to political theory methods of analysis and critique, through the development of skills in reading, critical thinking, and writing.",Internationalism
POLI 200-01,10542,Women and American Politics,T R,03:00 pm-04:30 pm,THEATR 203,Julie Dolan,5 / 25,"This course examines the evolutionary role of women in politics as voters, citizens, candidates, and leaders from the Seneca Falls Convention in 1848 to the present. Drawing from a variety of theoretical perspectives, we examine women's historical and contemporary roles in U.S. politics, investigate and debate a variety of public policy issues of particular concern to women, and explore the intersection of race and gender in U.S. politics. We pay special attention to the 2022 midterm elections, focusing on female identifying candidates’ decisions to run for office, their campaign strategies, and the intersections of race, party and gender identity on the campaign trail.",U.S. Identities and Differences
POLI 202-01,10543,US Campaigns and Elections,M W F,10:50 am-11:50 am,MAIN 010,Julie Dolan, Closed 1 / 25,"This course examines the centrality of race in our democracy, drawing on the 2022 midterm elections as they unfold. Elections are often touted as the lifeblood of democracy, providing opportunities for all citizens to create the government under which they live. Yet scholars today increasingly liken elections to mechanisms designed to preserve the “tyranny of the white majority.” Putting race at the forefront, we explore historical and current disenfranchisement efforts, campaign strategies, and patterns of political participation in the United States. Each student will track a competitive election throughout the semester, drawing on political science tools to interpret and explain November results.","Writing WA
                    Quantitative Thinking Q1
                    U.S. Identities and Differences"
POLI 203-01,10544,Politics and Inequality: The American Welfare State,M W F,09:40 am-10:40 am,CARN 305,Lesley Lavery, Closed 0 / 25,"The readings and assignments in this course are designed to help students understand how social policies and programs contribute to Americans' lived experiences.  We will examine various theoretical justifications for the policies that constitute the American welfare state, then confront and dissect major strands of the American social safety net to better understand how political institutions and policy mechanisms contribute to both diversity and inequality in individuals' social, economic and political outcomes (based in race, class, gender, dis/ability, region, political jurisdiction, etc.).","Writing WA
                    U.S. Identities and Differences"
POLI 206-01,10547,US Constitutional Law and Thought,W,07:00 pm-10:00 pm,CARN 206,Patrick Schmidt,-2 / 25,"An exploration of the structure of the American Political System as seen through the decisions of the U.S. Supreme Court. The central topics include the development of the federal-state relationship, the separation of powers in the national government, the limits of government power over the economy, and the role of the judiciary. This course takes in the sweep of American history from 1789 to the present. Prerequisite(s): POLI 100 recommended.",
POLI 215-01,10752,Environmental Politics/Policy,T R,09:40 am-11:10 am,THEATR 205,Roopali Phadke,1 / 20,"This course provides an introduction to the field of Environmental Politics and Policy. Using a comparative approach, the course engages the meaning and development of environmental governance. We will explore the tandem rise of the modern environmental movement and profound new environmental legislation in the U.S. and internationally. Topics investigated will include: deforestation, hazardous wastes, climate change, population growth, and loss of biodiversity.",
POLI 221-01,10548,Global Governance,T R,09:40 am-11:10 am,CARN 206,Wendy Weber,5 / 25,"This course is designed to introduce students to global governance. It begins with a discussion of the concept of global governance. It then turns to some of the central features of contemporary global governance, including the changing status of the state and of international/world organizations and the role of global civil society. The emphasis here is on how patterns of global governance have changed and are changing and on the implications of these changes for democracy, social justice, etc. The remainder of the course focuses on the areas of international peace and security, human rights and international humanitarian law, and economic governance. By addressing such topics as the International Criminal Court and the role of the IMF and the World Bank in economic development, these parts of the course highlight the contested nature of global governance in each of the three issue areas. Prerequisite(s): POLI 120 recommended.",Internationalism
POLI 224-01,10549,"Women, Peace and Security",M W F,10:50 am-11:50 am,THEATR 201,Wendy Weber,4 / 25,"In 2000, the United Nations Security Council adopted Resolution 1325 on Women, Peace and Security (WPS). This resolution acknowledged the inordinate impact of armed conflict on women and girls, as well as the crucial role that women can and do already play in conflict prevention, conflict resolution, peacekeeping and peacebuilding efforts. It urged states and other actors to increase the participation of women - and to incorporate gender perspectives - in all peace and security efforts. Since 2000, there have been nine additional resolutions that together have created the Women, Peace and Security agenda, a global framework for advancing gender equity in all areas of international peace and security. This course will explore feminist scholarship on armed conflict, peace and security leading up to the adoption of UNSCR 1325, as well as the 20 years of research, policy and practice on Women, Peace and Security. We will focus on the contributions and limitations of the WPS agenda as well as on new themes and issues that have emerged over time.",
POLI 242-01,10551,Political Economy of Development,T R,03:00 pm-04:30 pm,CARN 105,Lisa Mueller, Closed 1 / 20,"This course will help you answer questions about politics and economics in the developing world. For example: What explains global disparities in peace and prosperity? Is democracy good for the poor? Does foreign aid work? Our main objective is to use social science to describe and explain development outcomes. Although we will also address what can be done to solve problems such as poverty and civil war, this course will not provide any panaceas. If you finish the term unsatisfied and frustrated, you will have done something right! You will have begun to understand the complexity of development issues, which will equip you to contribute in a sophisticated way to ongoing scholarly and policy-oriented debates.","Writing WA
                    Internationalism"
POLI 242-F1,10550,Political Economy of Development,T R,01:20 pm-02:50 pm,CARN 105,Lisa Mueller,0 / 17,"This course will help you answer questions about politics and economics in the developing world. For example: What explains global disparities in peace and prosperity? Is democracy good for the poor? Does foreign aid work? Our main objective is to use social science to describe and explain development outcomes. Although we will also address what can be done to solve problems such as poverty and civil war, this course will not provide any panaceas. If you finish the term unsatisfied and frustrated, you will have done something right! You will have begun to understand the complexity of development issues, which will equip you to contribute in a sophisticated way to ongoing scholarly and policy-oriented debates.","Writing WA
                    Internationalism"
POLI 250-01,10626,Comparative-Historical Methods for Social Science,M W F,01:10 pm-02:10 pm,LIBR 250,Erik Larson, Closed -10 / 23,"This course introduces students to comparative and historical methods used in the social sciences, most prominently but by no means exclusively in sociology and political science. Comparative-historical researchers use huge comparisons to understand big structures and large processes that have immense importance for social life. The course addresses questions such as: How do social scientists gather and analyze evidence about macrosocial phenomena? What types of logic guide the definition and selection of cases? In addition, we learn about analytical choices facing comparative-historical researchers, including different methods of comparison and analysis of historical evidence. Beyond reading and discussing material about comparative-historical methods, we will analyze examples of research and apply lessons we learn to gain more familiarity with using comparative-historical methods.",Internationalism
POLI 269-01,10553,Empirical Research Methods,T R,09:40 am-11:10 am,HUM 302,Lisa Mueller,2 / 16,"This course will equip you with the skills and intuition to think about politics in a more critical and organized way.  You will practice the scientific method - identifying a problem worthy of study, developing testable hypotheses, designing a research strategy, gathering data, analyzing data, and interpreting your results - and contemplate the philosophical conundrums that underlie our efforts to describe, explain, and interpret complex phenomena. Empirical Methods: The department requires its majors to take one course in empirical research methodology before their senior year. In addition to this course, there are a number of other courses that fulfill this requirement, including: POLI 272, SOCI 269, SOCI 270, SOCI 275. In some cases, research methods courses taken in other social science disciplines may be used to fulfill this requirement following approval by the political science department chair.",Quantitative Thinking Q3
POLI 294-01,10994,Foreign Policy,M W F,03:30 pm-04:30 pm,CARN 206,Alexander Salt,15 / 25,"This course explores contemporary U.S. foreign policy. The primary goal is to give students the conceptual and critical tools needed to understand and analyze how international relations theory, U.S. foreign policy outcomes, and current events (such as the U.S. response to the Russian invasion of Ukraine) fit together. It is designed to develop students’ capacity both to explain the foreign policy-making process in the United States, and to better understand the underlying patterns, logic, and implications of American foreign policy.",
