number,crn,name,days,time,room,instructor,avail_max,desc,gen_ed
AMST 194-01,10002,Introduction to Asian American Studies,M W F,01:10 pm-02:10 pm,HUM 212,Jake Nagasawa,-3 / 18,"This course introduces the basic issues and concepts of Asian American Studies. We begin by looking at the birth of Asian American Studies as a field in response to student protests in the late 1960s. We then proceed to an overview of Asian American history beginning with U.S. imperialism in Asia and moving up to the present moment. For the remainder of the course we’ll focus on particular topics such as: the model minority myth; anti-Asian violence; multiracial Asian American identity; and Asian American activism. The approach of this course is interdisciplinary; it draws on theoretical and methodological insights from academic disciplines such as history, ethnic studies, and sociology.",U.S. Identities and Differences
AMST 194-F1,10001,What's After White Empire (and is it already here)?,T R,03:00 pm-04:30 pm,HUM 212,Karin Aguilar-San Juan,0 / 16,"From the Philippine-American War (1898-1910) to the global uprisings of May 2020, white supremacy and US imperialism have marched hand-in-hand, buttressed by cultures of violence and literal guns and tanks. Yet cracks in the walls of racism and empire have also always existed, with gestures of solidarity and whole solidarity movements pushing forward with new possibilities and imagined futures. In this discussion-based course, we will look for the common threads that link David Fagen (Black U.S. army soldier who defected and joined the Philippine nationalists in 1899) to the Vietnam antiwar movement (1955-1975) and to Grace Lee Boggs (Chinese American philosopher activist based in Detroit, 1905-2015) along with many other individuals and events. Among the significant questions we will consider are: What makes an insurrectionist different from an ally or a rabble rouser or a survivalist? What lessons can be drawn from the global COVID pandemic and the Russian war in Ukraine? How can we replace a culture of violence with a culture of peace? Books and films include: The White Racial Frame (Joe Feagin), How to be an Anti-Racist (Ibram X. Kendi), ""Amigo"" (John Sayles), ""American Revolutionary"" (Grace Lee).",Writing WA
AMST 203-01,10545,Politics and Inequality: The American Welfare State,M W F,09:40 am-10:40 am,CARN 305,Lesley Lavery, Closed 0 / 25,"The readings and assignments in this course are designed to help students understand how social policies and programs contribute to Americans' lived experiences.  We will examine various theoretical justifications for the policies that constitute the American welfare state, then confront and dissect major strands of the American social safety net to better understand how political institutions and policy mechanisms contribute to both diversity and inequality in individuals' social, economic and political outcomes (based in race, class, gender, dis/ability, region, political jurisdiction, etc.).","Writing WA
                    U.S. Identities and Differences"
AMST 225-01,10352,Native History to 1871,M W F,10:50 am-11:50 am,HUM 111,Jacob Jurss, Closed 3 / 20,"The history of American Indians is wonderfully complex, but this history is simultaneously fraught with misconceptions and misinterpretations. European (and, later, Euro-Americans) alternated among fascination, fear, and frustration toward American Indians, while American Indians sought to maintain tribal sovereignty and control over their lands, cultures, religions, politics, and lifestyles amidst continuing encroachment and settlement. This course examines American Indian history to 1871 - the year that Congress stopped making treaties with Native nations - by considering the complicated and multifaceted history of the nation's indigenous people. By looking at American Indian interactions with Spanish, French, British, and American explorers, settlers, missionaries, militaries, and government officials, this courses argues that the history of American Indians is essential to understanding past as well as present issues. Furthermore, this course looks to move beyond the notion that American Indian history is one of inevitable decline by creating a more nuanced understanding of the American Indian experience from pre-contact toward the twentieth century.",
AMST 231-01,10820,"Sovereignty Matters: Critical Indigeneity, Gender and Governance",M,07:00 pm-10:00 pm,ARTCOM 102,Kirisitina Sailiata, Closed 1 / 16,"This course is an introduction to Indigenous law and politics within and beyond the borders of the United States. Through debates around Indigenous governance, we will explore key concepts and theoretical frameworks of Indigenous gender and sexuality as a core analytical frame and method. Indigenous self-determination as a research agenda involves “processes of transformation, of decolonization, of healing, and of mobilization,” according to Linda Tuhiwai Smith. Students will generate a research project engaged with the political imperatives of self-determination, feminist research methods as well as recent intersections and queries of Indigenous studies.",U.S. Identities and Differences
AMST 237-01,10003,Environmental Justice,T R,01:20 pm-02:50 pm,HUM 212,Kirisitina Sailiata,-1 / 20,"Since the early twentieth century, the environment and sustainability have been core platforms across most contemporary social movements. This course begins its focus on the history of environmental activism locally in the Twin Cities to flashpoints across the Mississippi River watershed and beyond. Through a study of key figures and cases, we will explore the history and mobilization of environmental, climate and sustainability activism; the relationship between colonial and capitalist systems to contemporary environmental racism and inequality; and divergent approaches to research and scientific philosophies and practices. Students will work collaboratively on a community-based research project as part of their course portfolio.",U.S. Identities and Differences
AMST 240-01,10791,"Race, Culture, and Ethnicity in Education",T R,03:00 pm-04:30 pm,THEATR 205,Gonzalo Guzmán,2 / 24,"This survey course will explore history, policy, and pedagogy as they relate to race, ethnicity, and culture as education. K-12 public education will be the primary focus with topics including desegregation, standardized testing, multi-cultural and ethnocentric pedagogy, the teacher's role and experience, and significant historical events in education. The course will culminate by analyzing current trends and future expectations in education.",U.S. Identities and Differences
AMST 270-01,10005,Black Public Intellectuals,W,07:00 pm-10:00 pm,HUM 400,Duchess Harris,4 / 25,"This course will address the tradition of public intellectuals in numerous Black communities. We will expand the definition of ""politics"" to include theater, literature, and film. We will interrogate the concept of who chooses the scholarly leaders for Black communities. We will examine numerous topics such as Communism, The American Dream, Incarceration, Feminism, and Ebony Voices in the Ivory Tower.",U.S. Identities and Differences
AMST 271-01,10355,"Uses and Abuses: Drugs, Addiction and Recovery",M W F,01:10 pm-02:10 pm,HUM 302,Amy Sullivan, Closed 0 / 20,"After a brief but essential global history of drugs, this course will focus primarily on the 20th century to the present. We will examine histories of substance use and abuse, temperance and prohibition, the ""War on Drugs,"" the shifting concept of addiction as a moral failing to addiction as a treatable disease, as well as study the history of the recovery movement and harm reduction. This course is not intended to be an exhaustive, comprehensive history of the subject-but it will provide you with a solid base from which to explore other aspects of this fascinating and contentious aspect of human history.",U.S. Identities and Differences
AMST 294-01,10006,Endarkened Feminist Epistemologies,M W F,10:50 am-11:50 am,HUM 112,Ebony Aya,10 / 20,"Endarkened Feminist Epistemology (EFE) is an approach to research that honors the wisdom, memory, spirituality, and critical interventions of transnational Black woman’s ways of knowing (Dillard, 2016). A framework created by scholar Dr. Cynthia Dillard, it articulates how reality is known from the vantage point of transnational Black women -transnational recognizing the connections between African descended women throughout the diaspora as well as the continent. This class will explore EFE’s claims and methodologies, as well as center other transnational Black women whose work helps us make connections between history, spirituality, and our collective positionality within academia.",
AMST 294-04,10848,"Jazz Advance: Structure, Power, and Affirmation",T R,09:40 am-11:10 am,MUSIC 219,Randy Bauer,4 / 25,"The release of jazz pianist Cecil Taylor's 1956 debut album, ""Jazz Advance"", established yet another artistic benchmark – experimental, virtuosic, individually and collectively expressive – that subsequent jazz musicians would need to reach, and surpass.   Jazz history is full of such threshold moments, as each generation continued to elevate jazz – and thus the entire diaspora of Black America – to new artistic and socially progressive heights.  This course will trace the advancement of jazz from a regional articulation of African-American culture (New Orleans at the turn of the twentieth century), to a diverse international phenomenon, one whose fundamental thrust has served as a foil to prevailing white hegemony.  There are three basic aims: (1) a general historical survey of jazz's development, through primary source and scholarly readings, (2) an analysis of the stylistic evolution of jazz through the study of repertoire and recordings, and (3) critical analysis of race, gender, and cultural conflict throughout the ongoing legacy of what has been called one of America's great musical art forms.  The course will be mildly technical, with some use of printed music, but mainly designed to be accessible to students of all musical backgrounds.  A particular emphasis is placed on listening; students will become familiar by ear with a wide variety of jazz repertoire, artists, and styles.",U.S. Identities and Differences
AMST 308-01,10672,Introduction to U.S. Latinx Studies,M W F,10:50 am-11:50 am,HUM 212,Alicia Munoz,4 / 15,"This course provides an interdisciplinary discussion of the Latino experience in the United States with a focus on Mexican, Puerto Rican, Dominican, and Cuban- Americans. Using fiction, poetry, films and critical essays, we will examine issues of race and ethnicity, language, identity, gender and sexuality, politics, and immigration. This course satisfies the Area 2 requirement for the Spanish major. Prerequisite(s): SPAN 305 or SPAN 306",U.S. Identities and Differences
AMST 394-01,10010,Building Partnerships: Junior Seminar in Civic Engagement,M,07:00 pm-10:00 pm,THEATR 201,Karin Aguilar-San Juan,8 / 16,"Designed as a “practicum” (cohort study +  internship), the Fall 2022 Junior Seminar will focus on three themes: public health, environmental justice, and prison abolition. Two core concepts from American Studies– interdisciplinarity and ethical community partnerships–will connect and ground those themes. Through reading, reflection, discussion, and writing, we will explore the interactions across academic knowledge; self & community knowledge; work styles and communication; and what it means to “care” about an issue. In-class, side-by-side encounters with alumni and mentors from the internship sites will spur conversation on social change, career discernment, navigating resources, and stewarding relationships. The seminar will meet on Monday nights. During the night class, we will reflect on, write about, and contextualize your internship experiences; we will also meet with community leaders and alumni who will provide career advice and help you to plan for the future. This course requires concurrent registration in a 2-credit internship, which will satisfy the internship requirement for the American Studies major. Over the course of 10 weeks, you will spend 8 additional hours a week at your internship, for which you will receive 2 additional credits (for a total of 80 hours).",
AMST 400-01,10011,Senior Seminar,T R,09:40 am-11:10 am,HUM 217,Duchess Harris,5 / 16,The Senior Capstone is required of all majors. Majors who meet college criteria are encouraged to conduct an honors project in conjunction with their Senior Capstone.,
ANTH 101-01,10012,General Anthropology,M W F,08:30 am-09:30 am,CARN 06A,Scott Legge,0 / 30,"This course is an introduction to the discipline of anthropology as a whole. It presents students with a theoretical grounding in the four major subfields: archaeology, biological anthropology, cultural anthropology, and linguistics. In this class the emphasis is on the holistic nature of the discipline. Students will be challenged with some of the countless links between the systems of biology and culture. They will explore key questions about human diversity in the past, present, and future. Prerequisite(s): Not open to students who've taken ANTH 111.","Writing WP
                    Internationalism"
ANTH 111-01,10013,Cultural Anthropology,M W F,10:50 am-11:50 am,CARN 06A,Hilary Chart,3 / 30,"The cultural perspective on human behavior including case studies, often illustrated by ethnographic films and slides, of non-Western and American cultures. May include some field interviewing. Includes the cross cultural treatment of economic, legal, political, social and religious institutions and a survey of major approaches to the explanation of cultural variety and human social organization. Prerequisite(s): Not open to students who've taken ANTH 101.","Writing WP
                    Internationalism OR U.S. Identities and Differences"
ANTH 111-02,10894,Cultural Anthropology,M W F,02:20 pm-03:20 pm,MAIN 009,Jenna Rice Rahaim,1 / 30,"The cultural perspective on human behavior including case studies, often illustrated by ethnographic films and slides, of non-Western and American cultures. May include some field interviewing. Includes the cross cultural treatment of economic, legal, political, social and religious institutions and a survey of major approaches to the explanation of cultural variety and human social organization. Prerequisite(s): Not open to students who've taken ANTH 101.",Internationalism OR U.S. Identities and Differences
ANTH 194-01,10901,Introduction to Psychological Anthropology,M W F,01:10 pm-02:10 pm,CARN 06B,Eva Corsiglia-Melstrom,3 / 24,"In this course we will examine the early foundations and historical development of the field of psychological anthropology. Psychological anthropology can most simply be understood as a field of study that looks to investigate the ways in which individual experience on the one hand, and cultural meaning on the other, interrelate. Students will read and discuss Freud, Benedict, Sapir, Hallowell, Rosaldo, and Lutz, along with other recent central figures.",
ANTH 194-F1,10014,Food and Culture,M W F,08:30 am-09:30 am,CARN 06B,Arjun Guneratne,1 / 18,Varies by semester. Consult the department or class schedule for current listing.,"Writing WA
                    Internationalism"
ANTH 206-01,10393,Endangered/Minority Languages,M W F,09:40 am-10:40 am,ARTCOM 202,Marianne Milligan,1 / 20,"Language loss is accelerating at alarming rates. In fact, Linguists predict that only five percent of the six thousand languages currently spoken in the world are expected to survive into the 22nd century. In this course, we will examine the historical, political, and socio-economic factors behind the endangerment and/or marginalization of languages in Africa, Asia, Australia, Europe, and North and South America. We will also concentrate on the globalization of English (and other major languages), which plays a primary role in language endangerment and marginalization. Additional topics include: linguistic diversity, language policy, multilingualism (in both nations and individuals), global language conflict, and language revitalization. Students will have the opportunity to learn first-hand about these issues by interviewing speakers of an endangered and/or minority language.","Writing WA
                    U.S. Identities and Differences"
ANTH 230-01,10015,Ethnographic Interviewing,M W F,01:10 pm-02:10 pm,CARN 05,Arjun Guneratne,8 / 16,An introduction to ethnographic field interviewing learned in the context of individually run student field projects. Focuses on the anthropologist-informant field relationship and the discovery of cultural knowledge through participant observation and ethnosemantic interviewing techniques. Prerequisite(s): ANTH 101 or ANTH 111 or permission of instructor.,Writing WA
ANTH 239-01,10016,Medical Anthropology,T R,01:20 pm-02:50 pm,CARN 06A,Eva Corsiglia-Melstrom,4 / 24,"This course examines issues of health, illness, and healing from a variety of anthropological perspectives. From a cross-cultural perspective, we will examine the diversity of beliefs about human health and sickness, and a variety of healing practices by which people treat them. From the perspective of critical epidemiology, we will wrestle with recurrent problems of socioeconomic inequalities, ecological disruptions, and their impact upon the differential distribution, prevention, and treatment of human diseases. Previous courses in anthropology are recommended but not required.",
ANTH 258-01,10017,Dynamic Africa,T R,09:40 am-11:10 am,OLRI 270,Hilary Chart,17 / 24,"Africa has long been a continent on the move. This course introduces students to concepts associated with systems, process, and change in Africa by juxtaposing classic and contemporary ethnography that aims to get at how lives, subjectivities, and intimacies on the continent mediate and are shaped by global historical processes and how anthropologists have inhabited and tried to grasp such contexts. Toward this end, we draw on diverse representations of Africa that include fiction, film, and more traditional forms of scholarship. Prerequisite(s): ANTH 101 or ANTH 111.",Internationalism
ANTH 335-01,10385,Global Generosity,M W F,03:30 pm-04:30 pm,MAIN 009,Jenna Rice Rahaim, Closed -1 / 20,"From Italian Mafia dons to famous American philanthropists; from the knitting of ""trauma teddies"" in Helsinki to gift shopping in London; and from ceremonial exchange rings in Melanesia to the present day global refugee crisis: this course will investigate how generosity is understood and practiced in global perspective. We'll begin the semester by examining key debates surrounding reciprocity, gifts, and exchange, theories of altruism and generosity, and patron-client relations. We'll then explore the birth of the ""humanitarian spirit,"" and the complicated ethics and politics of humanitarian intervention. We will compare diverse religious traditions' approaches to giving, including Islam, Christianity, Hinduism, and Jainism. And we'll explore contemporary debates surrounding volunteerism within sectarian and neoliberal political regimes.",Internationalism
ANTH 340-01,10018,Human Evolution,T R,09:40 am-11:10 am,CARN 06B,Scott Legge,11 / 16,"An exploration of the interaction between ecology, morphology, and culture in human evolution. Topics include the evolutionary adaptation of non-human primates and hominins to their various ecological and social environments, taxonomic classification systems, and techniques used in the analysis of primate fossils to help determine both their geological age and phylogenetic placement. Prerequisite(s): ANTH 112, or ANTH 115, or ANTH 240 or permission of instructor.",
ANTH 369-01,10019,Food and Culture,M W F,09:40 am-10:40 am,CARN 06B,Arjun Guneratne,14 / 20,"This course is an introduction to the anthropology of food, focusing on how food creates community and shapes identity, class and gender. The course also covers the transition from foraging to agriculture, the role of particular foods in the making of the modern world, and the nature of the modern industrial food system. Prerequisite(s): ANTH 101 or ANTH 111.","Writing WA
                    Internationalism"
ANTH 394-01,10830,Ritual,T R,01:20 pm-02:50 pm,THEATR 101,Erik Davis,4 / 16,"The word “ritual” is used in many contexts to refer to types of practice that are considered centrally important, as well as formalistic and repetitive. This seminar-style course concentrates on the concept of ritual as a central component of social practice, within and without religious groupings. Focusing on developing the concept of ritual, we will focus on ritual across traditions. This requires students to ‘work with’ concepts - forming a conception of what they mean by ritual, and be willing to change that conception when faced with contradictory evidence.",Writing WA
ANTH 394-02,10834,Visual Storytelling: Researching with Digital and Visual Materials and Creating Visual Narratives,T R,09:40 am-11:10 am,OLRI 300,Rupak Shrestha, Closed 0 / 15,"Central to research is storytelling. This course provides the theoretical and methodological toolkits that students will use to conduct visual research in Geography and the Social Sciences. Drawing on Gillian Rose’s Visual Methodologies, the course surveys topics including research ethics, visual culture, discourse analysis, digital methods, participant observation and community-based research practices, and visual representation. Students will develop skills to observe, record, and analyze issues and processes in the local community in the Twin Cities through semester-long visual research projects by making still (photography) and moving (film) images. In addition, students will work on individual and group projects for hands-on experience on other digital methods. There are no prerequisites for this course and no prior background knowledge in visual methods or tools are required.",
ART 130-01,10021,Drawing I,M W,08:30 am-11:40 am,ART 302,Megan Vossler, Closed 0 / 15,"This course is an introduction to fundamental drawing materials and techniques. Students explore a variety of themes and subjects, including still life, architecture, figure drawing, portraiture, and imagination. Formal elements covered include: line, value, volume, space, proportion, perspective, mark-making, and composition. Context for assignments is given through frequent discussion of both historical and contemporary artworks. In group critiques and discussions, we consider composition, representational accuracy, creative expression, content, and intention.",
ART 130-02,10022,Drawing I,M W,01:10 pm-04:20 pm,ART 302,Joe Sinness,0 / 15,"This course is an introduction to fundamental drawing materials and techniques. Students explore a variety of themes and subjects, including still life, architecture, figure drawing, portraiture, and imagination. Formal elements covered include: line, value, volume, space, proportion, perspective, mark-making, and composition. Context for assignments is given through frequent discussion of both historical and contemporary artworks. In group critiques and discussions, we consider composition, representational accuracy, creative expression, content, and intention.",
ART 131-01,10023,Ceramics I,M W F,09:40 am-11:40 am,ART 113,Summer Hills-Bonczyk,1 / 14,"This introductory course will provide a supportive studio environment for the exploration of diverse approaches to the ceramic field, ranging from investigation of utilitarian object making to sculptural practice. Techniques and applications for both handbuilding and wheel throwing will be presented. Emphasis is placed on development and understanding of strong three-dimensional forms as well as the relationship with surface decoration. Content-based assignments allow for individual expression through creative problem solving. The course goal is to present students with a historical perspective and the understanding of contemporary ceramics, building an appreciation for the spirit of the handmade object as well as preparing students for upper level self-directed work. Lectures, demonstrations, critiques and gallery/museum visits will supplement studio work. Learning will be assessed primarily through portfolio production and review, along with class participation. Three two-hour periods per week. $100 materials fee is required.",
ART 149-01,10024,Introduction to Visual Culture,M W F,09:40 am-10:40 am,ARTCOM 102,Serdar Yalcin, Closed 4 / 25,"This course examines material and symbolic practices through myriad visual culture forms, from standards of fine art such as painting and sculpture to mass media including TV, film, advertising, and the Internet. Students will learn different theoretical paradigms and techniques for visual analysis in order to understand how visual culture mediates numerous social, economic, cultural and political relationships. We will investigate these diverse practices through lectures, guest speakers, film, historical art and media and, of course, those proliferating images that define our daily experiences. Offered every Fall.",
ART 160-01,10025,Introduction to Art History I: From Prehistory to the Medieval Period,M W F,12:00 pm-01:00 pm,ARTCOM 102,Serdar Yalcin, Closed -5 / 25,"​This course surveys the visual and material culture of Europe, the Middle East and the broader Mediterranean world from prehistory through the late Medieval period, including early Christian, Jewish and Islamic cultures. We consider the artistic and archaeological remains from the Near East, Egypt, the Aegean, Greece, Etruria, Rome, and western Europe from a contextual perspective in order to understand each culture's ideologies, and the diverse social and artistic purposes for which art and architecture was created and used.",
